{
  "$schema": "../../authoring/schemas/grind_budget.schema.json",
  "schema_version": 1,
  "registry_id": "industrial_frontier:grind_budget",
  "status": "STATIC_BASELINE_USER_TEST_PENDING",
  "limits": {
    "training_batches_max": 3,
    "manual_repeats_green_max": 3,
    "manual_repeats_hard_max": 8,
    "transfers_green_max": 4,
    "transfers_hard_max": 10,
    "passive_minutes_green_max": 3,
    "passive_minutes_hard_max": 8
  },
  "critical_components": [
    {
      "component_id": "industrial_frontier:component/p0/field_camp_supply",
      "epoch": 0,
      "status": "DESIGN_BASELINE",
      "title_ru": "Комплект снабжения полевого лагеря",
      "title_en": "Field Camp Supply Set",
      "mandatory": true,
      "required_refs": [
        "industrial_frontier:substance/raw_water",
        "industrial_frontier:substance/clay"
      ],
      "bootstrap_route_ru": "Первый комплект собирается вручную из безопасного запаса воды и глины; проверяется готовый функциональный лагерь, а не стопка сдаваемых блоков.",
      "automation_route_ru": "С P1 повторяемые партии снабжения выдаёт ранняя механическая линия и складской шаблон без покомпонентного микрокрафта.",
      "automation_epoch": 1,
      "mass_demand_epoch": 1,
      "budget_ref": "industrial_frontier:grind/p0/field_camp",
      "evidence_refs": [
        "docs/MASTER_DESIGN_DOCUMENT.md#P0"
      ],
      "gate": "M3_IMPLEMENTATION"
    },
    {
      "component_id": "industrial_frontier:component/p0/ore_prospecting_kit",
      "epoch": 0,
      "status": "DESIGN_BASELINE",
      "title_ru": "Комплект разведки рудной жилы",
      "title_en": "Ore Vein Prospecting Kit",
      "mandatory": true,
      "required_refs": [
        "industrial_frontier:process/gtceu/geological_ore_veins"
      ],
      "bootstrap_route_ru": "Первый комплект применяется вручную к одной гарантированно объяснённой геологической цели; бесцельный поиск редкой структуры не является воротами.",
      "automation_route_ru": "С P2 картирование и повторная подготовка разведочных партий поддерживаются промышленной геологией без повторения стартового поиска.",
      "automation_epoch": 2,
      "mass_demand_epoch": 2,
      "budget_ref": "industrial_frontier:grind/p0/ore_prospecting",
      "evidence_refs": [
        "docs/M2_SUBSTANCE_AND_BYPASS_AUDIT.md#worldgen"
      ],
      "gate": "M3_IMPLEMENTATION"
    },
    {
      "component_id": "industrial_frontier:component/p1/bulk_storage_module",
      "epoch": 1,
      "status": "ACTIVE_M2",
      "title_ru": "Пакет простого хранения",
      "title_en": "Bulk Storage Module",
      "mandatory": true,
      "required_refs": [
        "industrial_frontier:process/create/visible_batch_processing"
      ],
      "bootstrap_route_ru": "Первый пакет создаётся одним осмысленным массовым рецептом с сохранением полной материальной стоимости вместо серии одинаковых ручных крафтов.",
      "automation_route_ru": "На P1 пакет подаётся и складируется механически; дальнейшие партии не требуют повторного микрокрафта.",
      "automation_epoch": 1,
      "mass_demand_epoch": 1,
      "budget_ref": "industrial_frontier:grind/p1/bulk_storage",
      "evidence_refs": [
        "kubejs/server_scripts/00_core/recipes/01_bulk_storage.js"
      ],
      "gate": "USER_TEST_PENDING"
    },
    {
      "component_id": "industrial_frontier:component/p1/andesite_drive_train",
      "epoch": 1,
      "status": "DESIGN_BASELINE",
      "title_ru": "Андезитовый привод первой линии",
      "title_en": "Andesite First-Line Drive Train",
      "mandatory": true,
      "required_refs": [
        "industrial_frontier:energy/create_su",
        "industrial_frontier:substance/iron",
        "industrial_frontier:substance/copper"
      ],
      "bootstrap_route_ru": "Один учебный привод собирается вручную для понимания валов, передачи момента и направления потока; точные рецепты остаются gate M3.",
      "automation_route_ru": "После запуска P1 тот же привод изготавливается серийно средствами Create до первого массового спроса.",
      "automation_epoch": 1,
      "mass_demand_epoch": 1,
      "budget_ref": "industrial_frontier:grind/p1/andesite_alloy",
      "evidence_refs": [
        "docs/registries/bypass_decisions.json"
      ],
      "gate": "M3_RECIPE_DIFF"
    },
    {
      "component_id": "industrial_frontier:component/p2/brass_batch",
      "epoch": 2,
      "status": "ACTIVE_M2",
      "title_ru": "Паспортная партия латуни Cu3Zn",
      "title_en": "Cu3Zn Passport Brass Batch",
      "mandatory": true,
      "required_refs": [
        "industrial_frontier:process/create/heated_brass_batch"
      ],
      "bootstrap_route_ru": "Первая партия проходит видимое нагретое смешивание 3 Cu + 1 Zn → 4 Brass и подтверждает стехиометрию без ручной цепочки промежуточных деталей.",
      "automation_route_ru": "С P2 basin и транспорт Create непрерывно подают шихту и отводят каноническую латунь GTCEu.",
      "automation_epoch": 2,
      "mass_demand_epoch": 3,
      "budget_ref": "industrial_frontier:grind/p2/brass",
      "evidence_refs": [
        "kubejs/server_scripts/30_integrations/02_process_ownership.js"
      ],
      "gate": "USER_TEST_PENDING"
    },
    {
      "component_id": "industrial_frontier:component/p2/coke_steel_batch",
      "epoch": 2,
      "status": "DESIGN_BASELINE",
      "title_ru": "Тепловая партия кокса и стали",
      "title_en": "Coke and Steel Heat Batch",
      "mandatory": true,
      "required_refs": [
        "industrial_frontier:process/gtceu/foundational_feedstock_preparation",
        "industrial_frontier:substance/steel"
      ],
      "bootstrap_route_ru": "До трёх учебных партий вручную связывают подготовку кокса, промышленное тепло и выпуск стали; массовая стройка не начинается на ручной печи.",
      "automation_route_ru": "С P2 подача сырья, тепловой цикл и отвод стали автоматизируются до массового спроса P3.",
      "automation_epoch": 2,
      "mass_demand_epoch": 3,
      "budget_ref": "industrial_frontier:grind/p2/coke_and_steel",
      "evidence_refs": [
        "docs/MASTER_DESIGN_DOCUMENT.md#P2"
      ],
      "gate": "M3_IMPLEMENTATION_AND_OWNER_TIMING"
    },
    {
      "component_id": "industrial_frontier:component/p3/lv_control_set",
      "epoch": 3,
      "status": "DESIGN_BASELINE",
      "title_ru": "Комплект управления LV-ячейкой",
      "title_en": "LV Cell Control Set",
      "mandatory": true,
      "required_refs": [
        "industrial_frontier:substance/steel",
        "industrial_frontier:substance/copper",
        "industrial_frontier:substance/redstone"
      ],
      "bootstrap_route_ru": "Первый комплект собирается за одну учебную серию, чтобы показать корпус, проводник и управляющий материал без десятков однотипных вложенных деталей.",
      "automation_route_ru": "С P3 компоненты и сборка комплекта производятся LV-машинами пакетно до расширения электрического цеха.",
      "automation_epoch": 3,
      "mass_demand_epoch": 3,
      "budget_ref": "industrial_frontier:grind/p3/lv_components",
      "evidence_refs": [
        "docs/MASTER_DESIGN_DOCUMENT.md#P3"
      ],
      "gate": "M3_FULL_GRIND_AUDIT"
    },
    {
      "component_id": "industrial_frontier:component/p4/sulfuric_acid_batch",
      "epoch": 4,
      "status": "DESIGN_BASELINE",
      "title_ru": "Контрольная партия серной кислоты",
      "title_en": "Sulfuric Acid Control Batch",
      "mandatory": true,
      "required_refs": [
        "industrial_frontier:process/gtceu/industrial_chemistry",
        "industrial_frontier:substance/sulfur"
      ],
      "bootstrap_route_ru": "До трёх учебных партий вручную связывают серу, условия реакции и безопасный отвод кислоты; катализаторы не исчезают без причины.",
      "automation_route_ru": "С P4 подача реагентов, реакция и возврат допустимых носителей работают непрерывно до массового химического спроса.",
      "automation_epoch": 4,
      "mass_demand_epoch": 4,
      "budget_ref": "industrial_frontier:grind/p4/sulfuric_acid",
      "evidence_refs": [
        "docs/TECHNOLOGY_FEDERATION.md"
      ],
      "gate": "M4_GATED_CONTENT"
    },
    {
      "component_id": "industrial_frontier:component/p4/chlor_alkali_batch",
      "epoch": 4,
      "status": "DESIGN_BASELINE",
      "title_ru": "Контрольная партия азотно-хлорной химии",
      "title_en": "Nitrogen-Chlorine Chemistry Batch",
      "mandatory": true,
      "required_refs": [
        "industrial_frontier:process/gtceu/industrial_chemistry",
        "industrial_frontier:substance/salt"
      ],
      "bootstrap_route_ru": "Первая серия вручную разводит азотную и хлорную ветви и показывает опасные промежуточные условия без обязательного редкого RNG.",
      "automation_route_ru": "С P4 разделение, реакторы и безопасный отвод продуктов автоматизированы до первого городского массового заказа.",
      "automation_epoch": 4,
      "mass_demand_epoch": 4,
      "budget_ref": "industrial_frontier:grind/p4/nitrogen_chlorine_chemistry",
      "evidence_refs": [
        "docs/CURSEFORGE_CHEMISTRY_AUDIT.md"
      ],
      "gate": "M4_GATED_CONTENT"
    },
    {
      "component_id": "industrial_frontier:component/p4/water_treatment_train",
      "epoch": 4,
      "status": "DESIGN_BASELINE",
      "title_ru": "Контрольный контур водоподготовки",
      "title_en": "Water Treatment Control Train",
      "mandatory": true,
      "required_refs": [
        "industrial_frontier:process/gtceu/industrial_chemistry",
        "industrial_frontier:substance/raw_water"
      ],
      "bootstrap_route_ru": "Первый контур вручную проводит одну порцию сырой воды через разделение технической, питьевой и сточной ветвей.",
      "automation_route_ru": "С P4 насосы, очистка и возврат пригодной воды работают замкнуто без ручного переноса каждой порции.",
      "automation_epoch": 4,
      "mass_demand_epoch": 4,
      "budget_ref": "industrial_frontier:grind/p4/water_treatment",
      "evidence_refs": [